"﻿Miller J.";"A Program for Direct and Proxy Voting in the Legislative Process";"0-8014-9860-0 (paperback) 0-8014-0914-4 (cloth)";369-376;Druckerzeugnis;"05.12.2003 08:38";"In: Amacher Ryan C./Tollison Robert D: The Economic Approach to Public Policy";Haupt-Bibliothek;-;London;"Cornell University Press";-;;YQ;;;Wirtschaftswissenschaften;"Spezielle Betriebswirtschaftslehren";
"Schweiz. Nationalfonds/Programmleitung NFP 'Regionalprobleme'";"Überwälzungshypothesen zur effektiven regionalen Inzidenz des Bundeshaushaltes";;92;Druckerzeugnis;"05.12.2003 08:38";;Haupt-Bibliothek;"AG 342";Bern;;1981;;YN;;;Wirtschaftswissenschaften;"Konjunkturschwankungen, Stabilitätspolitik";
"Leblanc Hugh L./Allensworth Trudeau";"The Politics of States and Urban Communities";"SBN 06.043885.1";450;Druckerzeugnis;"05.12.2003 08:38";;Haupt-Bibliothek;"AC 162";"New York";"Harper & Row";1971;;YL1;;;Wirtschaftswissenschaften;"Finanzwissenschaft. Betriebswirtschaftliche Steuerlehre";Allgemeines
"Veröffentlichung der Schweiz. Verwaltungskurse";"Voranschlag und Rechnung der öffentlichen Gemeinwesen";;176;Druckerzeugnis;"05.12.2003 08:38";;Haupt-Bibliothek;"VD 101";Einsiedeln;"Benziger & Co.";1945;;YL2;;;Wirtschaftswissenschaften;"Finanzwissenschaft. Betriebswirtschaftliche Steuerlehre";"Haushaltsaufstellung, -verwaltung und -kontrolle"
"Linder Willi";"Wettbewerb - was ist das?";-;"Nov 41";Druckerzeugnis;"05.12.2003 08:38";"in: ISC (Hrsg.), The Spirit of Competition";Haupt-Bibliothek;-;-;-;-;;WD;;;"Uebrige Literatur";"Diverse Gebiete, Umweltschutz";
"Arthur Andersen & Co.";"Tax and Trade Guide .....";-;-;Druckerzeugnis;"05.12.2003 08:38";;Haupt-Bibliothek;"KA 313";-;"Arthur Andersen & Co.";1966;;KA;;;"Ausländisches Steuerrecht";"Staatenverbände, Staatengruppen";
"Willmott Peter";"Manpower and Education";-;44-69;Druckerzeugnis;"05.12.2003 08:38";"In: Cowan-Peter: The Future of Planning";Haupt-Bibliothek;-;-;-;-;;YL2;;;Wirtschaftswissenschaften;"Finanzwissenschaft. Betriebswirtschaftliche Steuerlehre";"Haushaltsaufstellung, -verwaltung und -kontrolle"
